{"aggregate":{"games":20,"gamesPerSecond":4.059,"peakRssBytes":null,"searchNodes":4560,"searchNodesPerSecond":58879.355,"transitions":4448,"transitionsPerSecond":472673.56},"benchmarkVersion":2,"configuration":{"gamesPerSample":1,"pairedRolloutRepetitionsPerSample":5,"sampleCount":20,"searchHorizon":2,"seeds":[0,31,4294967295]},"environment":{"arch":"x86_64","cpu":"unavailable","logicalCpuCount":24,"mode":"rust-release","os":"windows","peakRssMeasurement":"unavailable-without-unsafe-or-dependency","totalMemoryBytes":null},"gameReplay":{"aggregate":{"durationMs":4926.826,"operations":20,"perSecond":4.059},"latencyMs":{"median":240.445,"p95":258.705},"throughputPerSecond":{"median":4.154,"p95":4.287}},"measuredAtUnixMs":1788304237321,"pairedRollout":{"aggregate":{"durationMs":104.86,"games":200,"pairs":100,"transitions":43600},"estimated60SecondCapacity":{"games":114442,"method":"singleThreadShortSampleEstimate","pairs":57221,"transitions":24948500,"workload":"twoSeatSpeculativeRolloutOnly"},"pairLatencyMs":{"median":1.039,"p95":1.108},"replayPreflightOrientations":2,"samples":[{"durationMs":5.154,"games":10,"pairs":5,"transitions":2180},{"durationMs":5.142,"games":10,"pairs":5,"transitions":2180},{"durationMs":5.111,"games":10,"pairs":5,"transitions":2180},{"durationMs":5.288,"games":10,"pairs":5,"transitions":2180},{"durationMs":5.125,"games":10,"pairs":5,"transitions":2180},{"durationMs":5.163,"games":10,"pairs":5,"transitions":2180},{"durationMs":5.12,"games":10,"pairs":5,"transitions":2180},{"durationMs":5.207,"games":10,"pairs":5,"transitions":2180},{"durationMs":5.151,"games":10,"pairs":5,"transitions":2180},{"durationMs":5.412,"games":10,"pairs":5,"transitions":2180},{"durationMs":5.49,"games":10,"pairs":5,"transitions":2180},{"durationMs":5.316,"games":10,"pairs":5,"transitions":2180},{"durationMs":5.317,"games":10,"pairs":5,"transitions":2180},{"durationMs":5.297,"games":10,"pairs":5,"transitions":2180},{"durationMs":5.345,"games":10,"pairs":5,"transitions":2180},{"durationMs":5.243,"games":10,"pairs":5,"transitions":2180},{"durationMs":5.362,"games":10,"pairs":5,"transitions":2180},{"durationMs":5.251,"games":10,"pairs":5,"transitions":2180},{"durationMs":5.148,"games":10,"pairs":5,"transitions":2180},{"durationMs":5.22,"games":10,"pairs":5,"transitions":2180}],"seed":31,"throughputPerSecond":{"gamesMedian":1907.378,"gamesP95":1952.972,"pairsMedian":953.689,"pairsP95":976.486,"transitionsMedian":415808.347,"transitionsP95":425747.988},"uniqueSeeds":1},"searchNodes":{"aggregate":{"durationMs":77.447,"operations":4560,"perSecond":58879.355},"latencyMs":{"median":0.017,"p95":0.018},"throughputPerSecond":{"median":58951.288,"p95":60210.738}},"transitions":{"aggregate":{"durationMs":9.41,"operations":4448,"perSecond":472673.56},"latencyMs":{"median":0.001,"p95":0.008},"throughputPerSecond":{"median":483329.604,"p95":499886.903}}}
